{
  "skill_id": "S_Tlegacy001_v1",
  "teacher_id": "T_20260102_001",
  "teacher_name": "示例老师(真转写蒸馏)",
  "version": 1,
  "generated_at": "2026-06-04T21:36:50.568906+08:00",
  "style_tags": [
    {
      "text": "设问自答",
      "dimension": "interactivity",
      "source": "auto",
      "confidence": 0.9,
      "evidence": [
        "seg_0001",
        "seg_0003"
      ],
      "cluster_id": null
    },
    {
      "text": "由现象到概念",
      "dimension": "pace",
      "source": "auto",
      "confidence": 0.7,
      "evidence": [
        "seg_0001",
        "seg_0004"
      ],
      "cluster_id": null
    }
  ],
  "style_embeddings_model": "bge-base-zh-v1.5",
  "base_metrics": {
    "speech_rate": {
      "value": 233.7,
      "unit": "字/分",
      "label": "适中",
      "polarity": "mid"
    },
    "question_freq": {
      "value": 21.1,
      "unit": "次/10分钟",
      "label": "频繁互动",
      "polarity": "high"
    }
  },
  "pedagogy": {
    "concept_entry": {
      "primary": "problem-driven"
    },
    "intuition_building": {
      "order": "intuition-first",
      "before_formal": true
    },
    "analogy_density": {
      "level": "medium"
    },
    "blackboard_strategy": {
      "primary_layout": "title-bullets"
    },
    "misconception_alert": {
      "mode": "proactive-explicit"
    }
  },
  "quality": {
    "overall_grade": "NA",
    "publishable": false
  },
  "attributes": {
    "subject": "高等数学",
    "language": "zh"
  },
  "derived_from": "distill_demo (真 base_metrics + 真 style_tags + 占位 pedagogy)"
}