{
  "skill_id": "S_T20260604004_v2",
  "teacher_id": "T_20260604_004",
  "teacher_name": "思想道德与法治·某高校",
  "version": 2,
  "generated_at": "2026-06-04T14:41:00+08:00",

  "style_tags": [
    {
      "text": "设问自答引导思考",
      "dimension": "interactivity",
      "source": "auto",
      "confidence": 0.85,
      "evidence": ["f0_seg_0004", "f0_seg_0003", "f1_seg_0003"],
      "cluster_id": null
    },
    {
      "text": "编号分点条理清晰",
      "dimension": "detail",
      "source": "auto",
      "confidence": 0.90,
      "evidence": ["f0_seg_0001", "f0_seg_0004", "f1_seg_0003"],
      "cluster_id": null
    },
    {
      "text": "权威引证增强说服",
      "dimension": "rigor",
      "source": "auto",
      "confidence": 0.85,
      "evidence": ["f0_seg_0002", "f1_seg_0002", "f2_seg_0004"],
      "cluster_id": null
    },
    {
      "text": "爱用生活类比",
      "dimension": "abstraction",
      "source": "auto",
      "confidence": 0.80,
      "evidence": ["f2_seg_0002", "f2_seg_0003", "f2_seg_0006"],
      "cluster_id": null
    },
    {
      "text": "定义先行阐释后跟",
      "dimension": "abstraction",
      "source": "auto",
      "confidence": 0.80,
      "evidence": ["f0_seg_0003", "f0_seg_0005", "f2_seg_0002"],
      "cluster_id": null
    },
    {
      "text": "正反对照辨明是非",
      "dimension": "rigor",
      "source": "auto",
      "confidence": 0.75,
      "evidence": ["f2_seg_0006", "f2_seg_0007"],
      "cluster_id": null
    },
    {
      "text": "思政话语娓娓道来",
      "dimension": "pace",
      "source": "auto",
      "confidence": 0.75,
      "evidence": ["f0_seg_0002", "f1_seg_0006", "f1_seg_0010"],
      "cluster_id": null
    },
    {
      "text": "课末设问延伸思考",
      "dimension": "interactivity",
      "source": "auto",
      "confidence": 0.70,
      "evidence": ["f0_seg_0007", "f1_seg_0011"],
      "cluster_id": null
    },
    {
      "text": "编号递进层次分明",
      "dimension": "detail",
      "source": "auto",
      "confidence": 0.85,
      "evidence": ["f0_seg_0004", "f1_seg_0003", "f2_seg_0002"],
      "cluster_id": null
    },
    {
      "text": "理论联系学生实际",
      "dimension": "abstraction",
      "source": "auto",
      "confidence": 0.70,
      "evidence": ["f2_seg_0003", "f2_seg_0008"],
      "cluster_id": null
    }
  ],

  "style_embeddings_model": "bge-base-zh-v1.5",

  "base_metrics": {
    "speech_rate": {
      "value": 251.6,
      "unit": "字/分",
      "label": "适中",
      "polarity": "mid"
    },
    "question_freq": {
      "value": 2.76,
      "unit": "次/10分钟",
      "label": "偶尔提问",
      "polarity": "mid"
    }
  },

  "pedagogy": {
    "concept_entry": {
      "primary": "problem-driven",
      "signature_phrase": "如何理解……呢？/……有何特点呢？"
    },
    "intuition_building": {
      "order": "interleaved",
      "intuition_source": ["daily-life"],
      "before_formal": false
    },
    "analogy_density": {
      "level": "medium",
      "per_concept": 1,
      "domain_pool": ["大学生日常生活", "家庭生活场景"]
    },
    "blackboard_strategy": {
      "primary_layout": "title-bullets",
      "minimal_text": true
    },
    "misconception_alert": {
      "mode": "proactive-explicit",
      "timing": "after-definition",
      "signature_phrase": "反对……/错误本质是……"
    }
  },

  "quality": {
    "overall_grade": "NA",
    "publishable": false
  },

  "attributes": {
    "subject": "思想道德与法治",
    "language": "zh",
    "corpus_stats": {
      "transcripts_count": 3,
      "total_duration_sec": 1736.51,
      "total_text_chars": 7282
    }
  },

  "derived_from": "edunuwa-teacher-distiller (fork of huashu-nuwa)"
}
